{
  "schemaVersion": "1.0",
  "profile": "general-document",
  "type": "document",
  "id": "general-document-future-section",
  "title": "Unsupported section version",
  "children": [
    {
      "type": "section",
      "id": "part",
      "title": "Versioned section",
      "src": "content/sections/part.json"
    }
  ]
}
