{
  "schemaVersion": "1.0",
  "profile": "general-document",
  "type": "document",
  "id": "required-extension-fr",
  "title": "Extension requise non prise en charge",
  "lang": "fr-FR",
  "children": [
    { "type": "paragraph", "text": "Localized required-extension content must also remain blocked." }
  ]
}
